Hospital_Names,Addresses,Category,Contact_Info
Pedro L. Gindap Municipal Hospital,"Barbaza, Antique",Level 1/Primary,
Bugasong Medicare Community Hospital,"Bugasong, Antique",Level 1/Primary,
Culasi District Hospital,"Culasi, Antique",Level 2/Secondary,(036) 288-8241
Justice Calixto O. Zaldivar Memorial Hospital (Formerly Gov. Leandro Fullon District Hospital),"Pandan, Antique",Level 1/Primary,(036) 278-9041
Angel Salazar Memorial General Hospital,"Brgy. Atabay, San Jose Antique",Level 3/Tertiary,(036) 330-1830
Sebaste Community Hospital,"Sebaste, Antique",Level 1/Primary,(036) 278-2041
Ramon Masa Sr. Memorial District Hospital,"Sibalom, Antique",Level 2/Secondary,(036) 543-7670
Pres. Diosdado Macapagal District Hospital,"Tobias Fornier, Antique",Level 1/Primary,
Valderrama Municipal Hospital,"Valderrama, Antique",Level 1/Primary,
Sen. Gerardo Roxas Memorial District Hospital,"Dao, Capiz",Level 1/Primary,(036) 534-1039
Camp Peralta Station Hospital,"Jamindan, Capiz",Level 1/Primary,(036) 784-8236/68
Mambusao District Hospital,"Mambusao, Capiz",Level 2/Secondary,(036) 647-0641
Bailan District Hospital,"Bailan, Pontevedra Capiz",Level 2/Secondary,(036) 634-0381
Tapaz District Hospital,"Tapaz, Capiz",Level 2/Secondary,(036) 538-0049
Roxas Memorial Provincial Hospital,"Arnaldo Blvd., Roxas City Capiz",Level 3/Tertiary,(036) 621-0821/30
Buenavista Emergency Hospital,"Buenavista, Guimaras",Level 1/Primary,(033) 580-7892
Guimaras Provincial Hospital,"Jordan, Guimaras",Level 2/Secondary,(033) 581-3155/ 237-1492
Nueva Valencia District Hospital,"Lanipe, Nueva Valencia Guimaras",Level 1/Primary,
Aleosan District Hospital,"Alimodian, Iloilo",Level 1/Primary,(033) 331-0602
Barotac Viejo District Hospital,Barotac Viejo Iloilo,Level 1/Primary,(033) 362-0300 to 34
Ramon Tabiana Memorial District Hospital,"Cabatuan, Iloilo",Level 2/Secondary,(033) 522-8494/ 522-8549
Dr. Ricardo S. Provido Sr. Memorial Hospital,"Calinog, Iloilo",Level 2/Secondary,(033) 347-1919/ 347-1600
Dumangas District Hospital,"Dumangas, Iloilo",Level 2/Secondary,(033) 361-2229/ 361-2429
Rep. Pedro Trono Memorial District Hospital,"Guimbal, Iloilo",Level 2/Secondary,(033) 315-5551
Federico Roman Tirador Sr. Memorial District Hospital,"Janiuay, Iloilo",Level 2/Secondary,(033) 317-1319
Dr. Ricardo Y. Ladrido Memorial District Hospital,"Lambunao, Iloilo",Level 2/Secondary,(033) 533-7350
New Lucena Polytechnic College Medical Clinic and Hospital,"New Lucena, Iloilo",Level 1/Primary,(033) 526-2014
Don Jose S. Monfort Medical Center,"Barotac Nuevo, Iloilo",Level 2/Secondary,(033) 361-2010 to 11
Iloilo Provincial Hospital,"Pototan, Iloilo",Level 2/Secondary,(033) 529-7495 to 98
Western Visayas Sanitarium,Sta. Barbara Iloilo,Level 2/Secondary,(033) 523-9515
Sara District Hospital,,Level 2/Secondary,(033) 392-0244
Western Visayas Medical Center,"Mandurriao, Iloilo City",Level 4/Specialty,(033) 321-2841/ 321-3521
West Visayas State University Medical Center,"E. Lopez St. Jaro, Iloilo City",Level 4/Specialty,(033) 320-0870/ 320-2431
Don Valero Palmares Sr. Memorial District Hospital,Passi City Iloilo,Level 2/Secondary,(033) 311-5453/367-1641
Hinigaran Medical Clinic,"Hinigaran, Negros Occidental",Level 1/Primary,(034) 391-7129
Cauayan District Hospital,"Cauayan, Negros Occidental",Level 1/Primary,0930-6848327
Binalbagan Infirmary,"Binalbagan, Negros Occidental",Level 1/Primary,(034) 388-7701
Calatrava Municipal Hospital,"Calatrava, Negros Occidental",Level 1/Primary,(034) 727-7779
Gov. Valeriano Gatuslao Memorial District Hospital,"Himamaylan, Negros Occidental",Level 1/Primary,(034) 388-3783/744-7274
Jesus M. Colmenares District Hospital,"Balasan, Iloilo",Level 2/Secondary,(033) 397-0879
Eleuterio T. Decena Memorial Hospital,"Bacuyangan, Hinoba-an Negros Occidental",Level 1/Primary,(034) 471-3645
Ignacio Lacson Arroyo Sr. Memorial District Hospital,"Isabela, Negros Occidental",Level 1/Primary,(034) 387-2691
Valladolid District Hospital,"Valladolid, Negros Occidental",Level 2/Secondary,(034) 461-0360
Corazon Locsin Montelibano Memorial Regional Hospital,"Lacson St. Bacolod City, Negros Occidental",Level 4/Specialty,(034) 435-1591/ 434-6947
Bago City Hospital,"Brgy. Balingasag, Bago City Negros Occidental",Level 2/Secondary,(034) 461-0553/ 461-0172
Cadiz District Hospital,"Brgy. Daga National Highway, Hacienda Hortencia, Cadiz City, Negros Occidental",Level 2/Secondary,(034) 213-0236 to 37
Javillonar Clinic & Hospital,"73 Dr. Pilapil Street, Sagad, 1600, Pasig City",Level 1/Primary,6412303
Vicente Gustilo Memorial District Hospital,"Escalante City, Negros Occidental",Level 2/Secondary,(034) 213-0231
Kabankalan City Hospital,"Kabankalan City, Negros Occidental",Level 1/Primary,(034) 473-0547
Lorenzo D. Zayco District Hospital,"Kabankalan City, Negros Occidental",Level 2/Secondary,(034) 471-3645/ 471-3635
Dr. Gumersindo Garcia Sr. Memorial Hospital,"Kabankalan City, Negros Occidental",Level 1/Primary,(034) 471-2113
St. Jude's Hospital,"Kalibo, Aklan",Level 2/Secondary,(036) 268-8864
"Lady of Lourdes Hospital of Caybiga, Inc.","15 Gen. Luis Stre, Caybiga,1420, Kalookan City",Level 2/ Secondary,9835582
Don Salvador Benedicto Memorial Hospital,"La Carlota City, Negros Occidental",Level 2/Secondary,(034) 460-3360
Alfredo Maranon Sr. Memorial Hospital,"Brgy. Bato, Sagay City, Negros Occidental",Level 2/Secondary,(034) 722-4819/ 488-0167
Las Piñas City Doctors Hospital Inc,"8009 J.I. Aguilar Avenue, Pulang Lupa II, 1750, Las Piñas City",Level 4/ Specialty,8297715
San Carlos City Hospital,"San Carlos City, Negros Occidental",Level 2/Secondary,(034) 729-4151/ 312-5934
Teresita L. Jalandoni Provincial Hospital,"Silay City, Negros Occidental",Level 2/Secondary,(034) 495-1736/ 714-8485
Las Piñas City Medical Center,"1314 Marcos Alvarez,Talon V, Las Piñas City",Level 3/ Tertiary,
Aklan Cooperative Mission Hospital,"Kalibo, Aklan",Level 2/Secondary,(036) 262-4704/ 262-3925
Manila Adventist Medical Center & Colleges Inc.,"1975 Donada Street, 1300, Pasay City",Level 4/ Specialty,
St. Gabriel Hospital,"Kalibo, Aklan",Level 3/Tertiary,(036) 262-7193/ 262-7315
Aklan Baptist Hospital,,Level 2/Secondary,(036) 288-7063
Tugon Medical Clinic and Hospital,,Level 1/Primary,(036) 278-9100
Hospital de San Juan Bautista,"Kap. Isko, Brgy II, Lian , Batangas",Level 2/Secondary,(043) 333-0269
Don Ramon Tugbang Medical Center (Formerly Barotac Viejo Medical Center),"Zulueta Drive, Barotac Viejo, Iloilo",Level 2/Secondary,(033) 362-0262 to 64
Semirara Mining Corporation Hospital,"Semirara, Caluya Antique",Level 1/Primary,0921-8488995
Manila Doctors Hospital,"667 U.N. Avenue, Ermita, 1000, Manila",Level 4/ Specialty,5243011/5247376
Great Saviour International Hospital,"Solis St. Tap-oc, Molo, Iloilo City",Level 3/Tertiary,(033) 508-2227
Manila Naval Hospital,"Bonifacio Naval Station, Fort Bonifacio, Taguig City",Level 2/ Secondary,8928261
Iloilo Mission Hospital,"Mission Road, Jaro, Iloilo City",Level 4/Specialty,contact numberl (033) 320-0321
Zigzag Hospital,"P. Niogan, Mabini, Batangas",Level 1/Primary,(043) 487-0645
Maria Lourdes Maternity Hospital,"1076 Don Chino Roces Avenue, 1231, Makati City",Level 1/ Primary,8953846/8953847
St. Paul's Hospital,,Level 4/Specialty,(033) 337-2741/ 335-1177
Martinez Memorial Hospital,"198 Mabini Street, 1400 , Kalookan City",Level 2/ Specialty,2888661
Amosup Seamen's Hospital,"Onate St., Mandurriao, Iloilo City",Level 3/Tertiary,(033) 362-0262
Iloilo Doctor's Hospital Inc.,"West Avenue, Molo, Iloilo City",Level 4/Specialty,(033) 508-7045
Mary Chiles General Hospital,"667 Gastambide Street, Sampaloc, 1008. Manila",Level 4/ Specialty,7355341
St. Therese MTC College Hospital,"Jalandoni, San Agustin, Iloilo City",Level 3/Tertiary,(033) 508-2227
St. Anthony College Hospital,"San Roque Ext. Roxas City, Capiz",Level 3/Tertiary,(036) 621-6003
St. Nazarius Medical Clinic,"Pres. Laurel Highway, Malvar, Batangas",Level 1/Primary,(043) 406-0704
Mary Immaculate Hospital,"E. Rodriguez Ave., Bagong Ilog, 1600, Pasig City",Level 2/ Secondary,6713928
Capiz Doctor's Hospital,"Fuentes Drive, Roxas City, Capiz",Level 2/Secondary,(036) 621-5673 to 75
Capiz Emmanuel Hospital Inc.,"Roxas Avenue, Roxas City, Capiz",Level 3/Tertiary,(036) 621-4765
Medical Center Manila,"1122 Gen. Luna St., Ermita, 1000, Manila",Level 4/ Specialty,5243440
Bacolod Adventist Medical Center,"Taculing, Bacolod City, Negros Occidental",Level 4/Specialty,(034) 433-2255/ 432-0001
Mataas na Kahoy Community Hospital,"Rafael Lubis St., Mataas na Kahoy, Batangas",Level 2/Secondary,(043) 756-2279
Metro Psychotherapy Facility,"520 Dr. Sixto Antonio Avenue, Maybunga, Pasig City",,026436006
The Doctors Hospital Inc.,"B.S. Aquino Drive, Bacolod City Negros Occidental",Level 4/Specialty,(034) 433-1256
Dr. Pablo S. Torre Sr. Memorial Hospital,"Sen. B. Aquino Drive, Bacolod City, Negros Occidental",Level 4/Specialty,(034) 433-4093
Central Azucarrera Don Pedro Hospital,"Lumbagan, Nasugbu, Batangas",Level 2/Secondary,931-1035
Bacolod Our Lady of Mercy Specialty Hospital,"Eureco, Mandalagan Bacolod City, Negros Occidental",Level 3/Tertiary,(034) 434-9274
Metropolitan Hospital,"1357 Masangkay Street, Tondo, 1012. Manila",Level 4/ Specialty,2547356
Southern Negros Doctors' Hospital,"Don Emilio Village, Kabankalan City, Negros Occidental",Level 2/Secondary,(034) 471-3353
Mission Hospital,"Km. 17 Ortigas Avenue Extension, Rosario 1600, Pasig City",Level 2/ Secondary,6562816/0877/6554337
San Carlos Doctors' Hospital,"National Highway, San Carlos City, Negros Occidental",Level 2/Secondary,(034) 729-4049/729-4050/312-5609
Mother Regina Medical Facilites Inc. (Formerly Mother Regina Hospital),"2 Ruby Street, Dona Juana Subdivision, Rosario, 1609, Pasig City",Level 2/ Secondary,6412922/6413360
Immaculate Concepcion Health Center,"Victorias City, Negros Occidental",Level 1/Primary,(034) 399-2719
Metropolitan Medical Center - Nasugbu Branch,"Brgy. Batulao, Nasugbu, Batangas",Level 3/Tertiary,
Lopez District Farmers Hospital,"Sagay City, Negros Occidental",Level 2/Secondary,
M-TECH Medical Hospital,"379 Sen. Gil Puyat Avenue, Makati City",,8966751
New Bilibid Prisons Hospital,"Bu. of Corrections, NBP Reservation, 1702, Muntinlupa City",Level 2/ Secondary,8500143
Baliuag District Hospital,"Carpa Village, Sabang, Baliuag, Bulacan, Philippines",Level 2/ Secondary,044-7662364/2338
Rugay Maternity and General Hospital,"Sabang, Baliuag 237 M. Ponce St., Baliuag, Bulacan, Philippines",Level 2/ Secondary,044-7663457;7664629
Gregorio Del Pilar District Hospital,"Bagumbayan, Bulacan, Hilario St., Pob. Bustos",Level 2/Secondary,7922920
North Caloocan Doctors Hospital,"Lot 31, Blk. 10, Bankers Village 2, Quirino, Highway, Kalookan City",Level 2/ Secondary,9615213
Overseas Contact Workers General Hospital,"39 Tandang Sora Avenue, Brgy. Culiat, Quezon City",Level 2/ Secondary,9313529
Gregorio Del Pilar District Hospital,"Bagumbayan, Bulacan, Bulacan, Philippines",Level 2/ Secondary,7922920
Olivarez General Hospital,"Dr. A. Santos Avenue, Sucat Road, 1700, Paranaque City",Level 2/ Secondary,8258747
Gregorio Del Pilar District Hospital,"Bagumbayan, Bulacan, Hilario St., Pob. Bustos",Level 2/Secondary,7922920
Our Lady of Grace Hospital,"8th Avenue cor F. Roxas St,, Grace Park,1400, Kalookan city",Level 2/ Secondary,3611124
Dr. Romeo Isana Rosales General Hospital,"Batangas-Quezon Road, Padre Garcia, Batangas",Level 2/Secondary,(043) 515-9190
Palma-Malaluan Hospital,"J. Magtibay St., Rosario, Batangas",Level 2/Secondary,(043) 321-1410/0322
Our Lady of Lourdes Hospital,"46 P. Sanchez Street, Sta. Mesa, Manila",Level 4/ Specialty,7163901 to 20/7140046
Sto. Rosario Hospital,"V. Escano cor. Recto Sts., Rosario, Batangas",Level 2/Secondary,(043) 321-1025
Our Lady of Peace Hospital,"Coastal Road, Brgy, San Dionisio,Paranaque",Level 2/ Secondary,8295775/5720
Untalan General Hospital,"87 Gualberto Ave., Rosario, Batangas",Level 2/Secondary,(043) 321-1563
Solomon's Clinic,"Gen. Luna St., San Juan, Batangas",Level 1/Primary,(043) 575-4097
Divine Care Hospital Multi Services Corp.,"National Highway, Sico II, San Juan, Batangas",Level 2/Secondary,(043) 575-3408
"San Juan Doctor's Hospital, Inc.","Pulo, Calit-Calit, San Juan, Batangas",Level 2/Secondary,(043) 575-3138
P. Gonzales Memorial Hospital Inc.,"582 J.P. Rizal St., Lamuan, Malanday, Marikina City",Level 1/ Primary,9337231
Duque General Hospital,"San Juan, Batangas",Level 2/Secondary,(043) 575-5090
St. Nicholas Doctos General Hospital,"Pob., San Nicolas, Batangas",Level 1/Primary,(043) 210-5381
St. Frances Cabrini Medical Center,"Maharlika Highway, Sto. Tomas, Batangas",Level 3,(043) 7784811-15
Gregorio Del Pilar District Hospital,"Bagumbayan,Bulacan",Level 2 /Secondary,044-7920119; fax 7922920
Pamplona Medical Clinic,"46 Real St., Pamplona, 1701, Las Piñas City",Level 2/ Secondary,8730524/8576
Sto. Tomas General Hospital,"Pres. Laurel Highway, Sto. Tomas, Batangas",Level 2/Secondary,(043) 778-2117
Camarines Norte Provincial Hospital,"Daet, Camarines Norte",Level 3/Tertiary,056-7215457
Pascual General Hospital,"130 Quirino Highway Baesa, Quezon City",Level 2/Secondary,3625862
Labo District Hospital,"Labo, Camarines Norte",Level 2/Secondary,
Mendoza General Hospital,"Poblacion, Sta. Maria, Bulacan, Philippines",Level 2/ Secondary,044-8407086/6411582
The Lord's Hospital,"Meymart Road, Calvario,Meycauayan, Bulacan, Philippines",Level 2/ Secondary,044-8403381
Pasig Medical & Maternity Hospital Foundation Inc.,"101 London Street, Pasig Greenpark Village, Mangahan, 1600, Pasig City",Level 1/ Primary,6461067
Bicol Sanitarium,Cabusao Camarines Sur,Level 1/Primary-DOH Retained,(054)473-2244/ (054)472-4422
Caramoan Municipal Hospital,"Tawog, Caramoan, Camarines Sur",Level 1/Primary,63-054-4754917
Pasolo Maternity & Medical Clinic Inc.,"152 Pasolo St., Valenzuela City 1405",Level 1/ Primary,2923805
Perpetual Help Hospital,"1504 Laong Laan St., Sampaloc, 1008, Manila",Level 3/ Tertiary,7318177
Garchitorena Medicare Community Hospital,Catnub Pambuhan Garchitorena Camarines Sur,Level 1/Primary,
Philippine Air Force General Hospital,"Villamor Air Base, 1309, Pasay City",Level 3/ Tertiary,8535056
PNP General Hospital,"EDSA, Camp Crame, Quezon City",Level 3/ Tertiary,7230401 loc3066/7220670
San Miguel District Hospital,"Sta. Rita Old,San Miguel, Bulacan, Philippines",Level 2/ Secondary,044-6782070/7640130
Emmanuel Hospital,"San Jose, San Miguel, Bulacan, Philippines",Level 2/ Secondary,044-7640264/6780100/9133
Libmanan District Hospital,"Libmanan, Camarines Sur",Level 2/Secondary,(054) 511-8225
St. Vincent de Paul Hospital,"Pob. 2, Sto. Tomas, Batangas",Level 2/Secondary,(043) 778-1060
Ocampo Municipal Hospital,"Ocampo, Camarines sur",Level 1/Primary,475-3418/477-3160
St. Mary's Medical Services Inc.,"J.P. Rizal Street, Sta. Maria, Bulacan, Philippines",Level 2/ Secondary,044-6411416
Assumpta Medical Hospital,Assumpta Medical Hospital,Level 1/Primary,(043) 421-1267
Ragay District Hospital,"Ragay, Camarines Sur",Level 1/Primary,(054) 741-1134
Taal Polymedic Hospital and Medical Center,"Diversion Road, Carasuche, Taal Batangas",Level 3/Tertiary,(043) 214-2384
San Jose Medicare Community Hospital,"Del Carmen, San Jose, Camarines Sur",Level 1/Primary,(054) 454-2145
Presidential Security Group Station Hospital,"Malacanang Park 1005, Manila",,521-2301
Protacio Medical Services,"484 Quirino Avenue, Tambo, 1700, Paranaque",Level 2/ Secondary,8522953/8521360
St. Agnes General Hospital Inc.,"241 Roosevelt Ave., San Francisco Del Monte, Quezon City",Level 3/Tertiary,3741314
Ed & Tita's General Hospital,"206 Gov. E. Halili Ave., Bagbaguin, Sta. Maria, Bulacan",Level 1/ Primary,044-6412454
Sipocot District Hospital,"Sipocot, Camarines Sur",Level 2/Secondary,(054) 256-6349
Queensberry Hospital,"56 Ramires St., Novaliches, Quezon City",Level 2/ Secondary,4175827
Sta. Clara de Montefalco Hospital,"Km. 20 NLEX Servcie Rd. Malhacan, Meycauayan, Bulacan, Philippines",Level 3/ Tertiary,044-6953647
Siruma Municipal Hospital,Siruma Camarines Norte,Level 1/Primary,
Sabater General Hospital,"Caruncho Avenue, 1600, Pasig City",Level 2/ Secondary,6418194
St. Andrew Hospital,"Tumaway, Talisay, Batangas",Level 2/Secondary,(043) 773-0196
Salve Regina General Hospital Inc.,"Lot A2A Marcos Hi-way, Dela Paz, Pasig City",Level 2/ Secondary,9337133-35 fax 6453035
Calalang General Hospital,"16R Valenzuela St., Mc Arthur Hi-way, Marulas",Level 2/ Secondary,2916801 to 01 fax 2917113
San Juan De Dios Educational Foundation Inc.,"2772 Roxas Boulevard, 1300, Pasay City",Level 4/ Specialty,8319731 to 36/8315641 to 49
Tinambac Medicare Community Hosp.,"Tinambac, Camarines Sur",Level 1/Primary,
Santissimo Rosario General Hospital,"No. 2 Espiritu Street, Marulas",Level 2/ Secondary,2916985
Tuy General Hospital,"6 Burgos St., Tuy, Batangas",Level 2/Secondary,(043) 332-0046
San Ramon Hospital,"# 38 Gen. Ordoñez St., Rancho 4, Marikina City",Level 1/ Primary,9418040
John Paul Hospital,26 Mariano Ponce cor. Tirad Pass St.,Level 2/ Secondary,3618959 fax 3612401
Tinambac Municipal Infirmary,"Binmaley, Tinambac, Camarines Sur",Level 1/Primary,
San Roque Medical Clinic,"249 T. Montillano St., Alabang, Muntinlupa City",Level 1/Primary,8422950/2842/2856
South Superhighway Medical Center,"Km. 17 West Service Road, South Superhighway, Paranaque City",Level 3/ Tertiary,8235250/8218454
St. Claire's Medical Center,"1838 Dian St.1200, Makati City",Level 3/ Tertiary,8315445
Bicol Medical Center,"Concepcion Pequeña Sr., Naga City",level 4/specialty-doh retained,
C.P. Reyes Hospital,"A. Mabini Ave., tanauan City, Batangas",Level 2/Secondary,(043) 778-1119/1364
Daniel O. Mercado Medical Center,"Pres. J.P Laurel Highway, Tanauan City, Batangas",Level 4/Specialty,(043) 778-1810/0960
St. John the Baptist Hospital of Marikina,"23 Sta. Ana Ext. cor., Betelnut St., A. Tuazon, San Roque, Marikina City",Level 4/ Specialty,6823844/6478134
Naga City Hospital,"Peñafrancia Avenue, Naga City",Level 1/Primary,(054) 811-3213
Gonzales Medical & Childrens Hospital,"50 Sixto Castillo St., Tanauan City, Batangas",Level 2/Secondary,(043) 778-1218 / 405-0386
H.M. Corochea General Hospital,"Collantes Subd., Brgy. 7, Tanausan City, Batangas",Level 2/Secondary,(043) 778-1298
Silva's Clinic,"F. Platon St., Tanauan City, Batangas",Level 1/Primary,(043) 778-1072
Golden Gate General Hospital,"16 P. Prieto Street, Batangas City, Batangas",Level 4/Specialty,(043) 723-3011
St. Jude General Hospital and Medical Center,"Dimasalang corner Don Quijote Sts., Sampaloc, Manila",Level 4/ Specialty,7312761-65
"St. Patrick's Hospital and Medical Center, Inc.","Lopez Jaena St., Batangas City, Batangas",Level 3/Tertiary,(043) 723-7089/7092
St. Martin De Porres Charity Hospital,"70 A. Bonifacio Street, Barangay Kabayanan, San Juan City",Level 4/ Specialty,7230741 to 43
Batangas Health Care Hospital (Jesus of Nazareth),"Brgy. Gulod Itaas, Batangas City, Batangas",Level 3/Tertiary,(043) 722-0550
Sta. Rita de Baclaran Hospital,"0972 G. G. Cruz St., Baclaran, Paranaque City",Level 2/ Secondary,8317005
Lipa Medix Medical Center,"Balintawak, Lipa City, Batangas",Level 3/Tertiary,(043) 756-3008
Taguig - Pateros District Hospital,"East Service Road, Western Bicutan, Taguig City",Level 2/Secondary,8372144
Mary Mediatix Medical Center,"J.P. Laurel Highway, Mataas na Lupa, Lipa City, Batangas",Level 4/Specialty,756-6892 / 7571974
The Family Inc. Hospital,"1474 Maria Clara Street, Sampaloc, Manila",Level 4/Specialty,7312901
Metro Lipa Medical Center,"J.P. Laurel Highway, Marawoy, Lipa City, Batangas",Level 3/Tertiary,(043) 312-2668 / 756-0549
N.L. Villa Memorial Medical Center,"F. Manalo St., Lipa City, Batangas",Level 3/Tertiary,(043) 756-1217/4871
"San Antonio Medical Center of Lipa, Inc.","2 C.M. Recto Ave., Lipa City, Batangas",Level 2/Secondary,(043) 312-2003 / 756-2522
"Trinity Woman and Child Center ""The Birth Place""","2732 New Panaderos Street, Sta. Ana, Manila",Level 2/ Secondary,
U.P. Health Services,"J.P. Laurel Avenue Corner Apacible Agoncillo Streets U.P. Campus, Diliman, Quezon City",Level 1/ Primary,9283608
Unciano General Hospital,"393 Boni Avenue, 1501, Mandaluyong City",Level 2/ Secondary,5336565 to 66
Lipa Doctors Hospital,"Rizal Street, Lipa City",Level 1/Primary,(043) 756-2416 / 751-2141
Ospital ng Lungsod ng San Jose Del Monte,"Bagong Buhay I, Sapang Palay, Bulacan, Philippines",Level 2/ Secondary,09163121214
Dra. Araceli D. Mendoza Memorial Medical Clinic (formerly Holy Family Clinic),"24 Int. C.M. Recto Ave., Lipa City, Batangas",Level 1/Primary,(043) 756-2416
Bulacan Medical Center,"Majon, Malolos City, Bulacan, Philippines",Level 4/ Specialty,044-7910630/6622675
Divine Love General Hospital,"Sinagtala, Lipa City, Batangas",Level 2/Secondary,(043) 756-1338/2435
DLS - Dr. Rodolfo R. Poblete Memorial Hospital,"Burgos St., Alfonso, Cavite",Level 2/Secondary,(046) 415-0190 / 415-1286
Crisostomo General Hospital,"Dulong Bayan, Bacoor, Cavite",Level 2/Secondary,(046) 434-3195/4805
Molino Doctors Hospital,"Molino II, National Road, Bacoor, Cavite",Level 2/Secondary,
St. Michael Medical Center,"220 Molino II, Bacoor, Cavite",Level 2/Second,(046) 477-1757
Metro South Medical Center,"Molino IV, Bacoor, Cavite",Level 3/Tertiary,(046) 477-1743
Vian Family Hospital,"4041 Que Grande Street, Ugong, Valenzuela City",Level 1/ Primary,4325744
Villarosa Hospital,"11 Salalilla Street, Project 4, 1109, Quezon City",Level 2/ Secondary,9139705/4382995
Prime Global Care Medical Center,"Bahayang Pag-asa Subd., Molino, Bacoor",Level 2/Secondary,(046) 477-0806
St. Dominic Medical Center,"Talaba, Bacoor, Cavite",Level 3/Tertiary,(046) 417-2525/2520
Word of Hope General Hospital Foundation Inc.,"23 Buenamar Street, Buenamar Subdivision, Novaliches, Quezon City",,
University of Perpetual Help Rizal Medical Center,"Alabang-Zapote Road, Pamplona, 1740, Las Pinas",Level 4/ Specialty,8748515
Catalan Medical Hospital,"523 J.M. Loyola St., Carmona, Cavite",Level 1/Primary,(046) 430-0718
Dr. Jose Rizal Memorial Hospital,"Lawaan, Dapitan City",Level 2/ Secondary,065-2136222/065-2136421
Bongabon District Hospital,"De Lara Street, Brgy. Curva, Bongabon, Nueva Ecija, Philippines",Level 2/ Secondary,044-9610229; 0920-3270028
Zamboanga Del Norte Medical Center,"Turno, Sicayab,Dipolog City, Zamboanga del Norte",Level 2/ Secondary,065-2124120
Sindangan District Hospital,"Sindangan, 7112 Zamboanga del Norte",Level 2/ Secondary,09177229841
Labason District Hospital,"La Union, Labason, 7117 Zamboanga del Norte",Level 1/ Primary,0927-4455171
Siocon District Hospital,"Preztoza Street, Siocon, Zamboanga del Norte",Level 1/ Primary,
Piñan District Hospital,"Poblacion North, Piñan, 7105 Zamboanga del Norte, Philippines",Level 1/ Primary,09082990601
Liloy Integrated Health District Hospital,"National Highway, Liloy, Zamboanga del Norte, Philippines",Level 1/ Primary,0916-2482744
Manukan Medicare Community Hospital,"Poblacion, Manukan, Zamboanga del Norte, Philippines",Level 1/ Primary,0919-7373127
Sibutad Municipal Hospital,"Magsaysay, Sibutad, Zamboanga del Norte, Philippines",Level 1/ Primary,0918-3621874
Mayor Joaquin Macias G. Memorial Hospital,"Goleo, Sindangan, Zamboanga del Norte, Philippines",Level 1/ Primary,2242158
Dipolog Medical Center,"Mibang, Sta. Filomena, Dipolog City, Zamboanga Del Norte, Philippines",Level 2/ Secondary,065-2122555/065-2125486
Ospital Ng Kabataan Ng Dipolog,"604 Padre Ramon Street, Dipolog City, Zamboanga del Norte, Philippines",Level 2/Secondary,065-2122837
Santa Isabel General Hospital,"Sta. Isabel, Dipolog City, 7100 Zamboanga del Norte, Philippines",Level 2/ Secondary,065-2127016/065-2128550
Zamboanga Del Norte Cooperative Hospital,"Turno, Dipolog City, 7100 Zamboanga del Norte, Philippines",Level 2/ Secondary,065-2126990
Margosatubig Regional Hospital,"Poblacion, Margosatubig, Zamboanga del Sur, Philippines",Level 2/ Secondary,062-2115634
HCGC Medical Plaza Hospital,"260 San Jose St., Carmona, Cavite",Level 1/Primary,(046) 430-1017
De La Salle University Medical Center,"Congressional Ave., Dasmariñas, Cavite",Level 4/Specialty,(046) 416-0226
"St. Paul Hospital Cavite, Inc.","Burol II, Bagong Bayan, Dasmariñas, Cavite",Level 3/Tertiary,(046) 416-3877
Emilio Aguinaldo College Medical Center,"Brgy. Salitran II, Dasmariñas, Cavite",Level 3/Tertiary,(046) 820-2037 / 416-3010
Asia Medic Family Hospital and Medical Center,"Sitio Palapala, Sampalok 2, Dasmariñas, Cavite",Level 2/Secondary,(046) 416-1110
San Jose Hospital and Trauma Center,San Jose Hospital and Trauma Center,Level 2/Secondary,(046) 696-9840
Talavera Extension Hospital,"Maestrang Kikay, Talavera, Nueva Ecija, Philippines",Level 1/ Primary,044-4117960/61
General Trias Maternity & Pediatric Hospital,"Tejero, Gen. Trias, Cavite",Level 2/Secondary,(046) 437-81111 / 509-1325
Pagadian City Medical Center,"Cabrera Street,San Francisco District, Pagadian City",Level 3/ Tertiary,2143237
Aurora General Hospital,"Roxas Street, Aurora,Zamboanga del Sur, Philippines",Level 2/ Secondary,062-3312023
SSMC Satellite Hospital,"Gateway Business Park, Brgy. Javalera, General Trias, Cavite",Level 2/Secondary,(046) 433-0210
Divine Grace Medical Center,"Bypass Road, Tejero, Genral Trias, Cavite",Level 3/Tertiary,(046) 473-1177 / 887-2499
Kuta Cesar L. Sang-an Station Hospital,"Pulacan, Labangan, Zamboanga del Sur, Philippines",Level 1/ Primary,065-7138316
"Imus Family Hospital, Inc.","Justineville II Subd., Palico, Imus, Cavite",Level 2/Secondary,(046) 471-6403 / 970-6768
Midsalip Infirmary Hospital,"Midsalip,Zamboanga del Sur, Philippines",Level 1/ Primary,0905-4114337
Don Santiago Nahial Memorial Hospital,"Purok Sampaguita,Poblacion, Diñas,Zamboanga del Sur, Philippines",Level 1/ Primary,062-2114520
Our Lady of the Pillar Medical Center,"Tamsul, Ave., Bayan Luma, Imus, Cavite",Level 3/Tertiary,(046) 472-3773/3072
Medical Center Imus,"Diversion Road, Palico IV, Imus",Level 3/Tertiary,(046) 472-3987/3982
