Hospital_Names,Addresses,Category,Contact_Info
Kawit Maternity & General Hospital,"66 Freedom Park, Kaingin, Kawit, Cavite",Level 1/Primary,(046) 484-7363
Our Lady of the Way Medical And Pediatric Clinic,"92 Brgy. Cabulusan, Magallanes",Level 1/Primary,
Mahayag District Hospital,"San Vicente, Mahayag, Zamboanga del Sur, Philippines",Level 1/ Primary,0909-7167976
Blancia Hospital,"Blancia, Molave, Zamboanga del Sur, Philippines",Level 2/ Secondary,062-2252302
Bato Maternity And Children's Hospital,Bato Catanduanes,Level 1/Primary,63-52-8113865
Caramoran Municipal Hospital,Caramoran Catanduanes,Level 1/Primary,
S.S. Lumapas Medical Clinic,"Mabini Street, Molave, Zamboanga del Sur, Philippines",Level 1/ Primary,062-2252303
Chavez Medical Clinic,"Poblacion, Dinas, Zamboanga del Sur, Philippines",Level 1/ Primary,
Gigmoto District Hospital,Gigmoto Catanduanes,Level 1/Primary,
J. Cabahug Hospital,"Rizal Avenue,San Pedro District, Pagadian City, Zamboanga del Sur, Philippines",Level 2/ Secomdary,2141100/2153471
Pandan District Hospital,Pandan Catanduanes,Level 1/Primary,
Hofilena Hospital,"F. S. Fajares Avenue, Pagadian City, Zamboanga del Sur, Philippines",Level 1/Primary,062-2151689/062-2154044
Z.S. Health Services Cooperative Hospital,"Alano Street,Pagadian City, Zamboanga del Sur, Philippines",,
Biliran Provincial Hospital,"Naval, Biliran",Level 2/Secondary,(053) 500-9918
First Filipino Saint Hospital,"Brgy. San Roque, Gov. Drive, Naic, Cavite",Level 2/Secondary,(046) 412-1411/2298
Zamboanga del Sur Provincial Hospital,"Dao, Pagadian City, Zamboanga del Sur, Philippines",Level 2/ Secondary,062-2142467/2144698
"Metro Pagadian Hospital, Incorporated","V. Sagun Street,Lumbia District,Pagadian City, Zamboanga del Sur, Philippines",Level 1/ Primary,062-2153643
"Naic Doctors Hospital, Inc.","Daang Makina, Naic, Cavite",Level 2/Secondary,(046) 412-1443
Pagadian Doctors Hospital,"Rizal Avenue, Lumbia District, Pagadian City, Zamboanga del Sur, Philippines",Level 2/ Secondary,062-2143943
Sto. Domingo District Hospital,"Provincial Road, Pulong Bule, Sto. Domingo, Nueva Ecija, Philippines",Level 2/ Secondary,0917-3661830
St. Martin Maternity and Pediatric Hospital,"Salcedo II, Noveleta, Cavite",Level 2/Secondary,(046) 438-1112
San Antonio District Hospital,"San Mariano,San Antonio, Nueva Ecija, Philippines",Level 2/ Secondary,'09122360367; 044-4862534
Jamelarin Hospital,"Rizal Avenue,Bagong Silang,Balangasan District, Pagadian City. Zamboanga del sur, Philippines",Level 2/ Secondary,062-2153295/2144904
Contreras Medical Clinic,"Gen. Trias Drive, Rosario, Cavite",Level 2/Secondary,(046) 438-1958
Central Luzon State University Hospital,"CLSU cmpd., Bantug, Science City of Muñoz, Nueva Ecija, Philippines",Level 1/ Primary,044-4560689
Our Savior Hospital,"Gen. Trias Drive, Rosario, Cavite",Level 2/Secondary,
Juan M. Alberto Memorial District Hospital,San Andres Catanduanes,Level 1/Primary,
Viga District Hospital,San Vicente St. Viga Catanduanes,Level 1/Primary,+063 929 278 10 46 | +063 9296685756
Eastern Bicol Medical Center,Virac Catanduanes,Level 3/Tertiary,052-8111384
"Borbon General Hospital, Incorporated","0044 Rizal Avenue,Santa Lucia, Pagadian City, Zamboanga del Norte, Philippines",Level 2/ Secondary,1698 or 2141001
SSMC Satellite Hospital - Rosario Branch,"Abutin Bldg., Salinas Drive, Rosario, Cavite",Level 2/Secondary,(046) 438-7125
Salug Valley Medical Center (Formerly Igano Community Hospital),"CBurgos Street,Centro, Molave, Zamboanga del Sur, Philippines",Level 3/ Tertiary,062-2251427
Aroroy Municipal Hospital,Aroroy Masbate,Level 1/Primary,0921-7304423
Euser Medical Clinic,"Tambulig, Zamboanga del Sur, Philippines",Level 1/ Primary,0906-8573401
Balud Municipal Hospital,Balud Masbate,Level 1/Primary,
"St. Mazenod Hospital, Inc.","B113 L7&8 AFP Housing, Bulihan, Silang",Level 1/Primary,(046) 414-0793
Guimba District Hospital,"Pacac, Guimba, Nueva Ecija, Philippines",Level 2/ Secondary,0916-6158722
Heart of Jesus Hospital,"Brgy. R. Rueda, San Jose City, Nueva Ecija, Philippines",Level 2/ Secondary,044-5111282/2256; 9471703
Estrella Hospital,"Km 43, Aguinaldo Hi-way, Silang, Cavite",Level 2/Secondary,(046) 414-0793
San Jose City General Hospital,"Maharlika Highway, Brgy. Malasin, San Jose City, Nueva Ecija, Philippines",Level 2/ Secondary,044-5112265
Velazco Hospital,"J.P. Rizal, Sabutan, Silang, Cavite",Level 2/Secondary,(046) 414-0280
E.L. Joson Memorial Hospital (formerly Nueva Ecija Provincial Hospital),"Maharlika Hi-way,Daan Sarile, Cabantuan City, Nueva Ecija, Philippines",Level 2/ Secondary,044-6001424/5233/5234
Adventist University of the Philippines Health Service,"Putingkahoy, Silang, Cavite",Level 1/Primary,(049) 541-1228
Premiere Medical Center,"Daang Sarile, Maharlika, Highway, Cabanatuan City, Nueva Ecija, philippines",Level 4/ Specialty,044-4635868/6000267
Zamboanga Sibugay Provincial Hospital,"Sanito, Ipil,Zamboanga Sibugay, Philippines",Level 2/ Secondary,062-3332323
Dr. Paulino J. Garcia Memorial Research & Medical Center,"Mabini Street, Cabanatuan City, Nueva Ecija, Philippines",Level 4/ Specialty,044-4638286 / 4638888
Alicia District Hospital,"Poblacion, Alicia,Zamboanga Sibugay, Philippines",Level 1/ Primary,0915-4115370
Payao Municipal Hospital,"Poblacion, Payao,Zamboanga Sibugay, Philippines",Level 1/ Primary,
Silang General Hospital,"M.H. del Pilar, SIlang, Cavite",Level 1/Primary,(046) 686-1197
Olutanga Municipal Hospital,"Bateria, Olutanga, Zamboanga Sibugay, Philippines",Level 1/ Primary,
Tanza General Hospital,"Daang Amaya 2, Tanza, Cavite",Level 2/Secondary,(046) 505-1285
JNRAL Family Corporation Hospital,"A. Soriano Highway, Sahud Ulan, Tanza, Cavite",Level 1/Primary,(046) 686-3374
Cavite Medical Center,"767 Cavite Blvd., Dalahican, Cavite",Level 3/Tertiary,(046) 431-5650 / 504-4496
Cataingan District Hospital,Cataingan Masbate,Level 2/Secondary,0920-3587593 / 0921-5458640
Kabasalan Pathfinder Hospital,"Goodyear, Kabasalan, Zamboanga Sibugay, Philippines",Level 1/ Primary,062-3282215
Dela Cruz Maternity Hospital,"910 Crescini St., Caridad, Cavite City, Cavite",Level 2/Secondary,(046) 431-3185
Cawayan Municipal Hospital,Cawayan Masbate,Level 1/Primary,
Wilfredo S. Palma Memorial Hospital,"Poblacion, Diplahan Zamboanga Sibugay, Philippines",Level 1/ Primary,0915-6335522
Claveria District Hospital,Claveria Masbate,Level 1/Primary,
Bautista Hospital,"375 P. Burgos Ave., Caridad, Cavite City, Cavite",Level 3/Tertiary,(046) 431-0416/0330
Basilan General Hospital,"Binuangan, Isabela City , Philippines",Level 2/ Secondary,068-2007464
M.V. Santiago Medical Center,"Brgy. De Ocampo, Trece Martirez City. Cavite",Level 2/Secondary,(046) 419-0174/1877
Tagaytay Hospital and Medical Center,"E. Aguinaldo Highway, SIlang Crossing East, Tagaytay Rotonda, Tagaytay City, Cavite",Level 3/Tertiary,(046) 860-2529
Juan S. Alano Memorial Hospital,"Rizal Avenue, Isabela City, Philippines",Level 2/ Secondary,2003272
Moises Espinosa Sr. Memorial Municipal Hospital,Dimasalang Masbate,Level 1/Primary,
Calamba Medical Center,"Km 49 National Highway, Parian, Calamba City, Laguna",Level 3/Tertiary,(049) 545-2729
Mandaon Medicare Community Hospital,Mandaon Masbate,Level 1/Primary,
Ticao District Hospital,Ticao Masbate,Level 1/Primary,
Masbate Provincial Hospital,Masbate City Masbate,Level 3/Tertiary,3332244
Dr. Henry de Villa Memorial Hospital,"Poblacion, Ipil,Zamboanga Sibugay, Philippines",Level 2/ Secondary,062-3332291/5640/5543
Pantaleon G. Gotladera Memorial Hospital (Formerly Bulan Municipal Hospital),Bulan Sorsogon,Level 1/Primary,(056) 411-1272
"St. John the Baptist Medical Center, Inc.","Parian, Calamba City, Laguna",Level 2/Secondary,(049) 545-7258
M. Simon Hospital,"Poblacion, Ipil, Zamboanga Sibugay, Philippines",Level 2/ Secondary,062-3332235
"Immaculate Conception Medical Center of Central Luzon, Inc.","Circumferential Road,San Juan, Accfa, Cabanatuan City, Philippines",Level 3/ Tertiary,044-9400900/4262
Cabanatuan City MV Gallego General Hospital,"Maharlika Highway, Cabanatuan, City, Nueva Ecija, Philippines",Level 2/ Secondary,044-4639436;4639438
Vicente Peralta Memorial District Hospital,"Cumadcad, Castilla, Sorsogon",Level 2/Secondary,
Ipil Doctors` Hospital,"Sanito, Ipil, Zamboanga Sibugay, Philippines",Level 2/ Secondary,
Calamba Medical Center,"National Highway, Crossing, Calamba City, Laguna",Level 3/Tertiary,(049) 545-9162/6364
Donsol District Hospital,"Donsol, Sorsogon",Level 2/Secondary,
Pamana Medical Center,"National Highway, Brgy. Halang, Calamba City, Laguna",Level 2/Secondary,(049) 545-6858 / 834-4014
"Zamboanga Doctors Hospital, Inc","Veterans Avenue, Zamboanga City, Philippines",Level 3/ Tertiary,9911929
Fort Magsaysay Army Station Hospital,"7th ID, Fort Ramon Magsaysay, Palayan City, Nueva Ecija, Philippines",Level 1/ Primary,044-9632116
Dr. B.G. Donasco Medical Clinic and Hospital,"27 Prgy. Paciano, Rizal, Calamba City, Laguna",Level 1/Primary,(049) 834-2684
Gubat District Hospital,"Gubat, Sorsogon",Level 2/Secondary,(056) 311-1100
Gamez Hospital,"218 J.P. Rizal St., Calamba City, Laguna",Level 2/Secondary,(049) 545-3461
Irosin District Hospital,"Irosin,Sorsogon",Level 2/Secondary,(056) 555-3131
Ciudad Medical Zamboanga,"Nunez Extension, Zamboanga City, Philippines",Level 3/ Tertiary,062-9927330-7
"San Jose Hospital and Trauma Center, Inc.","Doctors Compound, Mapayapa, Calamba City, Laguna",Level 2/Secondary,(049) 531-7005
Magallanes Medicare Community Hospital,"Magallanes, Sorsogon",Level 1/Primary,
"Western Mindanao Medical Center, Inc","Veterans Ave. Extension, Zamboanga City, Philippines",Level 3/ Tertiary,062-9912506-07/9913101/9911104
Matnog Medicare Community Hospital,"Matnog, Sorsogon",Level 1/Primary,
St. Clement Medical Clinic,"49 D. Fandiño St., Brgy. 3, Alaminos, Laguna",Level 1/Primary,(049) 567-1531
Prieto Diaz Municipal Hospital,"Prieto Diaz, Sorsogon",Level 1/Primary,
"Dr. Fernando B. Duran, Sr. Memorial Hospital","Macabog, Sorsogon City",Level 3/Tertiary,2111032
"Zaec Community Medical Center, Inc","San Jose Road, Zamboanga City, Philippines",Level 3/ Tertiary,062-9901733/9930009
"Brent Hospital & College, Inc","R.T. Lim Boulevard, Zamboanga City, Philippines",Level 3/Tertiary,062-9912990
"Biñan Doctors Hospital, Inc.","Platero, Biñan, Laguna",Level 3/Tertiary,(049) 511-9159
Redoble Medical Clinic,"082 National Highway, Buug, Zamboanga Sibugay, Philippines",Level 1/ Primary,0918-5969657
"Gemarino Hospital Kauswagan,","Diplahan Zamboanga Sibugay, Philippines",Level 1/ Primary,
Amoroso Medical Clinic,"National Highway, Poblacion, Imelda, Zamboanga Sibugay, Philippines",Level 1/ Primary,0909-3287666
UPH - Dr. Jose G. Tamayo Medical Center,"National Highway, Sto. Niño, Biñan, Laguna",Level 4/Specialty,(049) 511-8959
Concepcion District Hospital,"Brgy. Alfonso, Concepcion, Tarlac, Philippines",Level 2/ Secondary,045-9230852/0642
Our Lady of Piat Polyclinic & Hospital,"Blk. 11 Lot 13, South City Drive, Biñan, Laguna",Level 1/Primary,
Los Baños Doctors Hospital,"Brgy. Batong Malake, Los Baños, Laguna",Level 3/Tertiary,(049) 536-1225/1825
St. Jude Family Hospital,"Lopez Ave., Batong Malake, Los Baños, Laguna",Level 2/Secondary,(049) 536-1982 / 827-0283
HealthServ Los Baños Hospital and Medical Center,"8817 National Highway, Brgy. Batong Malaki, Los Baños, Laguna",Level 1/Primary,(049) 536-8501
Paete General Hospital,"J.P. Rizal Street, Quinale, Paete, Laguna",Level 2/Secondary,(049) 817-0392 / 557-9995
St. Michael General Hospital,Bacacay Albay,Level 1/Primary,052-4846284
Ludovice General Hospital,Daraga Albay,Level 2/Secondary,052-4834649
Gata General Hospital,"Gen. Simeon Ola St., Guinobatan, Albay",Level 1/Primary,052-8380869
Kabasalan General Hospital,"Santa Cruz, Kabasalan Zamboanga Sibugay, Philippines",Level 1/Primary,0917-7111632
Retuerma General Hospital,"Rizal St., Guinobatan, Albay",Level 1/Primary,920-7002213
Danao-Sale Medical Clinic,"Crossing Sta Clara, Naga, Zamboanga Sibugay, Philippines",Level 1/ Primary,
Lianko's Medical Clinic,"Malinao, Albay",Level 1/Primary,052-4884000
Saint John General Hospital,"Buug, Zamboanga Sibugay, Philippines",Level 2/ Secondary,
Dr. Manuel R. Rebueno Memorial Hospital,"Iraya Sur, Oas, Albay",Level 1/Primary,052-4856427
Christian General Hospital,"564 A.Mabini, Pagsanjan, Laguna",Level 2/Secondary,(049) 808-4051
Lumbis-Rances General Hospital,"Ilao Sur, Oas, Albay",Level 2/Secondary,052-4856209
Romeo B. Sibud County Hospital,"Poblacion, Titay, Zamboanga Sibugay, Philippines",Level 1/Primary,9359581809
"Pagsanjan Medical Clinic, Inc.","Brgy. Sampalocan, Pagsanjan, Laguna",Level 2/Secondary,(049) 501-4882
Pathfinder Estate Hospital,"Kabasalan, Zamboanga Sibugay, Philippines",Level 1/ Primary,062-3282217
Dr. Erlinda B. Estanislao Memorial Hospital,"Pavia Blvd., Pio Duran, Albay",Level 1/Primary,(052) 540-0481
Lanceta Medical Hospital,"National Highway, Poblacion, Imelda Zamboanga Sibugay, Philippines",Level 1/ Primary,0927-5003855
Zapanta General Hospital,"Banawan, Pioduran, Albay",Level 2/Secondary,
"Divine Mercy Hospital, Inc.","L9/10 Amante Subd., Brgy. Nueva, San Pedro, Laguna",Level 2/Secondary,(049) 808-3448
Isip General Hospital,"Gabon, Polangui, Albay",Level 1/Primary,(052) 835-0421
"Evangelista Medical Specialty Hospital, Inc.","L9/10 Amante Subd., Brgy. Nueva, San Pedro, Laguna",Level 2/Secondary,(049) 808-3448
Basilan Community Hospital,"Aguada, Isabela City, Philippines",Level 2/ Secondary,2003273
G. Gonzales Medical Clinic,"Brgy. Naga, Tiwi, Albay",Level 1/Primary,052-4885045
Family Care Hospital,"Macaria Ave., Pacita 1, San Pedro, Laguna",Level 2/Secondary,(049) 808-4897
Infante Hospital Management Corporation,"Carlos P. Garcia Street, Isabela City , Philippines",Level 2/ Secondary,2007426
"San Pedro Doctors Hospital, Inc.","National Highway, Landayan, San Pedro, Laguna",Level 2/Secondary,02-8681962-64
Laguna Holy Family Hospital,"1864 J. De Leon St., Sta.Cruz, Laguna",Level 2/Secondary,(049) 808-1911
"Sta. Cruz Laguna Polymedic, Inc.","780 National Highway, Patimbao, Sta. Cruz, Laguna",Level 2/Secondary,(049) 810-4309
"Laguna Doctors Hospital, Inc.","P. Guevarra St., Sta. Cruz, Laguna",Level 2/Secondary,(049) 808-0548/4094
Jesus the Savior Hospital,"St. Angel Central, Sta. Cruz, Laguna",Level 2/Secondary,(049) 810-0748
New Sinai MDI Hospital,"National Highway, Tagapo, Sta. Rosa City, Laguna",Level 3/Tertiary,(049) 838-1281 / 534-3499
Southern Luzon Hospital and Medical Center,"Greenfield Ave., Don Jose, Sta. Rosa City, Laguna",Level 3/Tertiary,(049) 544-0120/0130/0125
"Zamboanga Childrens Hospital, Inc","Pilar Street, Zamboanga City, Philippines",Level 2/ Secondary,062-9913870
"Balibago Polyclinic and Hospital, Inc.","Provincial Road, Balibago, Sta. Rosa City, Laguna",Level 2/Secondary,(049) 534-1591 / 837-2879
Dr. Bernardo B. Corral Memorial Hospital,"San Lorenzo St. Tiwi, Albay",Level 1/Primary,052-8885553
Zamboanga Puericulture Center Maternity Lying-in Hospital,"Pura, Brillantes Street, Zamboanga City, Philippines",Level 2/ Secondary,062-9910379
Dr. Amando D. Cope Memorial Hospital,"Ruivivar St., Tayhi, Tabaco, Albay",Level 2/Secondary,052-8301334
Cabredo General Hospital,"Moses St. Tabaco City, Albay",Level 2/Secondary,052-4877072
Jaime B. Berces Memorial Hospital,"V. Demetriou St., Tabaco, Albay",Level 2/Secondary,052-8301160
Edwin Andrews Airbase Hospital,"Sta. Maria, Zamboanga City, Philippines",Level 1/ Primary,
Rico's Hospital,"Berces St., Tabaco City, Albay",Level 1/Primary,052-2577153
Tabaco College Hospital,"Tomas Cabiles Avenue, Tabaco City",Level 2/Secondary,052-4875443
Camp Navarro General Hospital,"Upper Calarian, WESTMIINCOM, Zamboanga City, Philippines",Level 2/ Secondary,9931204
St. James Hospital,"Mariquita Pueblo, Brgy. Dita, Sta. Rosa City, Laguna",Level 3/Tertiary,(049) 837-6996
Dr. Sofronio B. Garcia Memorial Hospital,"Ligao, Ligao City",Level 1/Primary,052-4311398
Perpetual Help Clinic,"Bunao, Ligao, Albay",Level 1,052-8370875
Mindanao Central Sanitarium,"Pasobolong, Zamboanga City, Philippines",Level1/ Primary,9262491
Estevez Memorial Hospital Inc.,Estevez St. Guevarra Subd. Legaspi City,Level 3/Tertiary,052-2455031
Tanchuling Hospital,"Imperial Court Subd., Phase II, Legaspi City, Albay",Level 3/Tertiary,052-8202913
"Aquinas University Hospital, Foundation, Inc.","Washington Drive, Legaspi City",Level 3/Tertiary,052-4810331
Labuan Public Hospital,"Labuan, Zamboanga City, Philippines",Level 1/ Primary,9260259
Ago General Hospital,"Rizal St., Legaspi City",Level 3/Tertiary,052-8201971
Dr. Esteban V. Ante Memorial Hospital,"573 Rizal St., Brgy. 18, Legaspi City, Albay",Level 1/Primary,052-2455632
Albay Doctors Hospital,"Peñaranda St., Legazpi City",Level 3/Tertiary,(052) 480-7838/480-7848
Zamboanga City Medical Center,"Dr. Evangelista Street, Zamboanga City, Philippines",Level 4/ Specialty,9912934/9920052/9920154
Leon D. Hernandez Memorial Hospital,1328 Dasmarinas St. Daet Camarines Norte,Level 3/Tertiary,054-4401406
Our Lady Of Lourdes Hospital,"Lourdes Hospital Road, Iriga City,",Level 3/Tertiary,054-7212664
Santissima Trinidad Hospital Of Daet,"Diversion Road, Camambugan, Daet, Camarines Norte",Level 3/Tertiary,(054) 571-2788
Sto. Nino Hospital,"Mercedes Road, Daet, Camarines Norte",Level 3/Tertiary,054-7211581
Dr. Miguel V. Alegre Hospital,"Burgos St., Labo, Camarines Norte",Level 1/Primary,(054) 585-2287
St. John The Apostle Hospital,"Villaflores St., Labo, Camarines Norte",Level 1,(054) 585-2166/054-5852036
Saint Jude Hospital of Labo,"Villaflores St., Labo, Camarines Norte",Level 1/Primary,054-5852287
Sta. Rosa Hospital and Medical,"RSBS Blvd., San Lorenzo South, Balibago, Sta. Rosa City, Laguna",Level 3/Tertiary,(049) 837-8408 / 02-5208421
Jose Panganiban Primary Hospital Services Coop,"North Poblacion, Jose Panganiban, Camarines Norte",Level 1/Primary,(054) 731-7960
Rosary of Virgin Mary Hospital,"M.Roxas St., Sta. Elena, Camarines Norte",Level 1/Primary,054-2013156
Dr. Robosa Hospital,"142 Sta. Cruz, Baao, Camarines Sur",Level 2/secondary,(054) 266-3011
St. Jude Clinic & Hospital,"120 Luneta St., Sta. Cruz, Baao, Camarines Sur",Level 1/Primary,054-2663029
St. Raphael Hospital,"San Nicolas, Baao, Camarines Sur",Level 1/Primary,(054) 266-3181
Baesa Advent Polyclinic & General Hospital,"238 Retiro Street, Baesa Road 1400, Kalookan City, Philippines",Level 1/ Primary,3302108
"St. John Hospital, Inc.","Panganiban Drive, Naga City, Camarines Sur",Level 3/Tertiary,054-8111554
St. John Hospital,"San Jose St., Goa, Camarines Sur",Level 2/Secondary,054-2663111
St. Vincent de Ferrer Hospital,"Rizal St., Goa, Camarines Sur",Level 1/Primary,054-4777078
Rinconada Medical Center,"Nabua, Camarines Sur",Level 2/Secondary,
"Marian Hospital of Sta. Rosa, Inc.","816-A National Rd., Brgy. Tagapo, Sta. Rosa City, Laguna",Level 2/Secondary,(049) 838-1952
Our Lady of Salvacion Clinic,"Sipocot, Camarines Sur",Level 1/Primary,054-4531442
"Community General Hospital of San Pable City, Inc.","C. Colago Avenue, San Pablo CIty, Laguna",Level 3/Tertiary,(049) 562-2035 / 562-1314
Dr. Nilo O. Roa Memorial Foundation Hospital,"424 Dimasalang St., Naga City, Camarines Sur",Level 2/Secondary,054-8115089
Sts. Francis and Paul General Hospital,"Farconville Subd., San Pablo City, Laguna",Level 2/Secondary,(049) 562-8097
Mother Seton Hospital,"Roxas Avenue, Diversion Road, Naga City, Camarines Sur",Level 4/Specialty,054-4724025
Lourdes Hospital,"San Roque, Iriga City, Camarines Sur",Level 2/Secondary,(054) 299- 2777
Our Lady Of Mediatrix Hospital,"San Jose, Iriga City, Camarines Sur",Level 2/Secondary,
Sta. Maria Josefa Foundation Hospital,"Francia, Iriga City, Camarines Sur",Level 2/Secondary,(054) 299-3101
Our Lady Of Fatima Hospital,"Bagong Bayan, Panganiban Catanduanes",Level 1/Primary,
Dr. A. P. Zantua Memorial Hospital,"Francia Street, Virac, Catanduanes",Level 2/Secondary,ca/~zantua/hospital/
Immaculate Heart Of Mary Hospital,E. Rafael St. Brgy. Rawis Virac Catanduanes,Level 2/Secondary,(052) 811-0580/82
"Good Samaritan Health Care System, Inc.","Burgos Avenue, Cabanatuan City, Nueva Ecija, Philippines",Level 3/ Tertiary,044-158285/4643969
Wesleyan University General Hospital and Cardiovascular Center,"Tandang Sora Street Corner Mabini Extension, Cabanatuan City, Nueva Ecija, Philippines",Level 3/ Tertiary,044-4634735
San Pablo Doctors Hospital,"55 A. Mabini St., San Pablo City, Laguna",Level 3/Tertiary,(049) 562-0998
St. Joseph Medical Clinic,"Poblacion, Dimasalang, Masbate",Level 1/Primary,(056) 333-4561
Dubongco's Medical Clinic,"Rosero St., Milagros, Masbate",Level 1/Primary,
"Immaculate Conception Hospital, Inc.","P. Alcantara Street, San Pablo City, Laguna",Level 2/Secondary,(049) 562-5132
Masbate Doctors Hospital,"Rosero St., Masbate City, Masbate",Level 2/Secondary,(056) 333-2103
St. Martin De Porres Medical Clinic,"Domingo St., Masbate",Level 1/Primary,(056) 333-2386
San Pablo Colleges Medical Center,"San Rafael, Maharlika Highway, San Pablo City, Laguna",Level 3/Tertiary,(049) 567-0726 / 562-0728 (fax)
Emil Joanna General Hospital,"147 Quezon Ct,. Atimonan, Quezon",Level 2/Secondary,(042) 316-5390 / 511-1092
Del Carmen Medical Clinic,"360 Pica St., Brgy. 5, Calauag, Quezon",Level 1/Primary,(042) 301-7156
St. Vincent Medical Clinic & Hospital,Masbate,Level 1/Primary,(056) 333-2375
"De Castro Hospital Foundation, Inc.","9 Fontelar St., Milagros, Masbate",Level 1/Primary,(056) 333-2675
St. Jude Medical Clinic,"Luna St., Bulan, Sorsogon",Level 1/Primary,(056) 411-1353
Bulusan Family Clinic,"Central Bulusan, Sorsogon",Level 1/Primary,(056) 311-0348
Sorsogon Medical Mission Group Hospital & Health Services Cooperative,"Bibincahan, Sorsogon City, Sorsogon",Level 3/Tertiary,(056) 211-1861/ 211-3042
St. Peter General Hospital,"Quezon St., Calauag, Quezon",Level 2/Secondary,(042) 301-2305/7834
"Sts. Peter & Paul Hospital, Inc.","612 Alegre St., Balogo, Sorsogon",Level 2/Second,
Sto. Niño Hospital,"Poblacion, Bustos, Bulacan, Philippines",Level 2/ Secondary,044-7662176/1646/9030327
"Peter Paul Medical Center of Candelaria, Inc.","Regidor St., Pob,. Candelaria, Quezon",Level 2/Secondary,(042) 585-4531 telefax / 741-1857
"St. Therese of The Child Jesus Hospital, Inc.","Jimenez St., Bacon, Sorsogon",Level 2/Secondary,
United Candelaria Doctors Hospital,"Brgy. Mangilag Sur, Candelaria, Quezon",Level 2/Secondary,(042) 585-2114
San Diego de Alcala General Hospital,"Aguinaldo St., cor. Tanada, Gumaca, Quezon",Level 2/Secondary,(042) 317-4829
Holy Rosary Hospital,"San Isidro St., Brgy. Talolong, Lopez, Quezon",Level 2/Secondary,(042) 302-5255
Bulacan Medical Mission Group Pharmacy and Hospital - Turo Branch,"Turo, Bocaue, Bulacan, Philippines",Level 2/ Secondary,044-6414502/6921237
"Dr. Yanga's Hospital, Inc","252 P. Burgos Street, Poblacion, Bocaue, Bulacan, Philippines",Level 2/ Secondary,044-6925307/9208289
Lopez St. Jude General Hospital Corp.,"Real St., Brgy. Burgos, Lopez, Quezon",Level 2/Secondary,(042) 302-5244 / 841-1015
Malolos San Vicente Hospital,"Caniogan, Mallolos City, Bulacan, Philippines",,
Lucban MMG Hospital,"38 Katipunan St., Lucban, Quezon",Level 2/Secondary,(042) 540-8312
"Jane County Hospital, Inc.","C.M. Recto, Brgy. Castillo, Pagbilao, Quezon",Level 2/Secondary,(042) 731-1295
Soler General Hospital,"Mabini St., Brgy. 6, Sariaya, Quezon",Level 1/Primary,(042) 651-1036
"Greg Hospital-Sariaya, Inc.","Gen. Luna St., Sariaya, Quezon",Level 2/Secondary,; (042) 651-1162 / 525-8487
"Arsenal ""Kalusugan"" Hospital","Camp Gen. Luna, Lamao, Limay, Bataan, Philippines",Level 2/ Secondary,047-2445624; 2444615
Maragusan Municipal Hospital,"Talisay St., Poblacion, Maragusan, Compostela Valley",Level 1/Primary,920-5639228
Bagac Community & Medicare Hospital,"Brgy. A Ricardo, Bagac, Bataan, Philippines",Level 1/ Primary,0917-8662868
Compostela Valley Provincial Hospital,"Compostela, Davao del Norte",Level 2/Secondary,(084) 299-1194
Jose C. Payumo Jr. Memorial Hospital,"San Ramon, Dinalupihan, Bataan, Philippines",Level 2/ Secondary,047-4811724; 4811536
Pantukan District Hospital,"Townsite, Pantukan, Compostela Valley",Level 1/Primary,084-3720335
"Liwag Medical Clinic, Inc.","1 Mayo St., Pob. II, Tiaong, Quezon",Level 2/Secondary,(042) 545-7672
Orani District Hospital,"Lourdes Street, Ma. Fe Subdivision, Orani, Bataan, Philippines",Level 2/ Secondary,047-4312827
Bataan Provincial Hospital,"Manahan Street, Tenejero, Balanga City, Bataan",Level 3/ Tertiary,047-2372269/3635 7915959/2857
Laak Municipal Hospital,"Laak, Compostela Valley Province",Level 1/Primary,
Carmen District Hospital,"Carmen, Davao del Norte",Level 1/Primary,084-6286592
St. Cecilia Hospital,"M. Castillo St., Tiaong, Quezon",Level 1/Primary,(042) 545-9217
Mariveles Mental Hospital,"P. Monroe Street, Poblacion, Mariveles, Bataan, Philippines",,9354612/4138
"Tayabas Community Hospital, Inc.","Brgy. Wakas, Tayabas, Quezon",Level 3/Tertiary,(042) 793-2216
Bataan Doctor's Hospital & Medical Center,"Cauderno St. Doña Francisca Subd., Balanga City, Bataan. Philippines",Level 2/ Secondary,047-2372050; 2370307
Dr. Erlinda P. Tolentino Medical Clinic and Hospital,"Ibabang Kalilayan, Unisan, Quezon",Level 1/Primary,(042) 549-8511
Bataan St. Joseph Hospital,"Don Manuel Banzon Avenue, Brgy. Doña Francisca, Balanga City, Bataan, Philippines",Level 3/ Tertiary,
Kapalong District Hospital,"Quezon St., Maniki, Kapalong",Level 2/Secondary,084-3710468
Mt. Carmel Dioscesan General Hospital,"Allarey Extension, Lucena City, Quezon",Level 3/Tertiary,(042) 710-2576 to 77 / 373-2025 to 26
Isaac & Catalina Medical Center,"Calero Street, Ibayo, Balanga City, Bataan, Philippines",Level 2/ Secondary,047-2371435; 2374003
Lucena MMG Genral Hospital,"Ibabang Dupay - Red V, Lucena City, Laguna",Level 3/Tertiary,(042) 373-5926
Samal District Hospital,"Peñaplata, Igacos",Level 1/Primary,0916-5562179
Bataan Peninsula Medical Center,"San Ramon, Dinalupihan, Bataan, Philippines",Level 2/ Secondary,047-2372043/4815969
